{
  "name": "Sportlich plakativ",
  "slug": "sportlich-plakativ",
  "beschreibung": "Vollflächige Bildbühnen mit riesiger, enger Versalien-Schlagzeile und runden Pillen-Knöpfen auf reinem Weiß. Die Oberfläche bleibt monochrom und zurückgenommen, damit Bilder und Produkte den Ton angeben.",
  "schlagworte": [
    "Sport",
    "Plakat",
    "Versalien",
    "Pillen",
    "Monochrom",
    "Vollbild",
    "Kompakt"
  ],
  "kategorien": [
    "Modern",
    "Business",
    "Minimal",
    "Dunkel"
  ],
  "gegenbeispiel": false
}
