{
  "name": "Galerie monochrom",
  "slug": "galerie-monochrom",
  "beschreibung": "Ruhige, neutral-graue Oberfläche mit riesigen Versal-Titeln, die Bildmaterial und Projektkarten wie in einer Ausstellung präsentiert. Dunkle Akzentflächen und farbige Kategorie-Pastelle setzen gezielte Signale.",
  "schlagworte": [
    "Galerie",
    "Grau",
    "Versalien",
    "Inter Tight",
    "Karten",
    "Kuratiert",
    "Kontrast"
  ],
  "kategorien": [
    "3D",
    "Animiert",
    "Modern",
    "Minimal",
    "Editorial"
  ],
  "gegenbeispiel": false
}
