{
  "name": "Katalog hell",
  "slug": "katalog-hell",
  "beschreibung": "Ruhige, helle Galerie aus hochformatigen Titelkacheln auf kühlem Grauweiß. Zentrierte Rubrikzeilen, fast keine Dekoration, dunkle Verlaufsflächen als seltener Kontrast.",
  "schlagworte": [
    "Katalog",
    "Karussell",
    "Poster",
    "hell",
    "grau",
    "zentriert",
    "Kacheln"
  ],
  "kategorien": [
    "Modern",
    "Video",
    "Minimal",
    "Verspielt"
  ],
  "gegenbeispiel": false
}
