{
  "name": "Smaragd luftig",
  "slug": "smaragd-luftig",
  "beschreibung": "Helle, ruhige Produktseite mit hauchdünnen Überschriften, einem einzelnen Smaragdgrün als Signal und feinem Hintergrundraster. Große Pillenknöpfe, weiche Karten mit 24px Radius und Produktfenster als Hauptbild.",
  "schlagworte": [
    "hell",
    "smaragd",
    "luftig",
    "leicht",
    "pillen",
    "software"
  ],
  "kategorien": [
    "Modern",
    "Minimal",
    "Tech/SaaS",
    "Aktuell"
  ],
  "gegenbeispiel": false
}
