{
  "name": "Kino Kontrast",
  "slug": "kino-kontrast",
  "beschreibung": "Tiefschwarze Bühne mit vollflächigen, filmischen Motiven, einem einzigen scharfen Rot und kantigen Versalien-Knöpfen. Helle Grauflächen für Hinweise und Fußbereich halten das Ganze nüchtern und funktional.",
  "schlagworte": [
    "Schwarz",
    "Rot",
    "Filmisch",
    "Eckig",
    "Versalien",
    "Vollbild",
    "Kontrast"
  ],
  "kategorien": [
    "Modern",
    "Video",
    "Dunkel"
  ],
  "gegenbeispiel": false
}
