{
  "name": "Marktplatz monochrom",
  "slug": "marktplatz-monochrom",
  "beschreibung": "Schwarz auf Weiß mit hellgrauen Flächen und einem einzigen warmen Orangerot als Signal. Runde Pillen-Knöpfe und abgerundete Bildkacheln machen einen großen Katalog übersichtlich und freundlich.",
  "schlagworte": [
    "Shop",
    "Katalog",
    "Monochrom",
    "Pillen",
    "Sachlich",
    "Responsive"
  ],
  "kategorien": [
    "Modern",
    "Minimal"
  ],
  "gegenbeispiel": false
}
