{
  "name": "Indigo Leicht",
  "slug": "indigo-leicht",
  "beschreibung": "Helle, luftige Produktseite mit hauchdünner Grotesk, kühlem Blaugrau und einem einzigen kräftigen Indigo. Ein farbenfroher Verlaufsakzent setzt den Auftritt, der Rest bleibt ruhig und präzise.",
  "schlagworte": [
    "indigo",
    "leicht",
    "verlauf",
    "klar",
    "fintech",
    "hell",
    "präzise"
  ],
  "kategorien": [
    "Animiert",
    "Modern",
    "Business",
    "Tech/SaaS"
  ],
  "gegenbeispiel": false
}
