{
  "name": "Kino Glut",
  "slug": "kino-glut",
  "beschreibung": "Tiefschwarze Bühne mit glühend rotem Signalknopf, zentrierter Riesen-Headline und schräg gekachelten Motivwänden im Hintergrund. Große Tippflächen, kräftiger Kontrast und ein Hauch Nachtblau machen die Seite sofort bedienbar.",
  "schlagworte": [
    "dunkel",
    "kinoartig",
    "rot",
    "zentriert",
    "kontrastreich",
    "Streaming",
    "Hero"
  ],
  "kategorien": [
    "Modern",
    "Video",
    "Dunkel"
  ],
  "gegenbeispiel": false
}
