{
  "name": "Pastell Kachel",
  "slug": "pastell-kachel",
  "beschreibung": "Heller, freundlicher Shop-Auftritt auf Weiß mit pastellfarbenen Flächen, rotem Versal-Display und tiefgrünen Aktionsknöpfen. Runde Bildkacheln und Pillen-Buttons machen ihn zugänglich und handlich.",
  "schlagworte": [
    "pastell",
    "shop",
    "rund",
    "frisch",
    "bunt",
    "freundlich",
    "kacheln"
  ],
  "kategorien": [
    "Modern",
    "Verspielt"
  ],
  "gegenbeispiel": false
}
