{
  "name": "Urban Kontrast",
  "slug": "urban-kontrast",
  "beschreibung": "Schwarz-weißer Shop-Stil mit dunklem Vollbild-Hero, großer enger Grotesk und winzigen Radien. Funktional, sportlich und ohne Schatten.",
  "schlagworte": [
    "Schwarzweiß",
    "Grotesk",
    "Shop",
    "Sport",
    "Kontrast",
    "Flach",
    "Urban"
  ],
  "kategorien": [
    "Modern",
    "Business",
    "Minimal",
    "Dunkel"
  ],
  "gegenbeispiel": false
}
