{
  "name": "Plattform klar",
  "slug": "plattform-klar",
  "beschreibung": "Helle, nüchterne Produktseite mit kräftigen Inter-Überschriften, einem einzigen Orange als Signal und einem tiefen Nachtblau im Fuß. Sachlich, vertrauenswürdig und auf Orientierung ausgelegt.",
  "schlagworte": [
    "Tech",
    "Orange",
    "Klar",
    "Hell",
    "Plattform",
    "Sans",
    "Sachlich"
  ],
  "kategorien": [
    "Modern",
    "Business",
    "Tech/SaaS"
  ],
  "gegenbeispiel": false
}
