{
  "name": "Video-Hero",
  "slug": "video-hero",
  "beschreibung": "Kinoformat: eine großflächige Bewegtbild-Bühne mit Text-Overlay, Kapitelleiste und ruhigen Abschnitten darunter. Der Film trägt die Marke.",
  "schlagworte": [
    "video",
    "kino",
    "vollbild",
    "overlay",
    "bühne"
  ],
  "kategorien": [
    "Video",
    "Dunkel",
    "Luxus"
  ],
  "gegenbeispiel": false
}
