{
  "name": "Mitternacht leicht",
  "slug": "mitternacht-leicht",
  "beschreibung": "Tiefschwarze Flächen mit grünlichem und blauem Schimmer, darauf riesige, federleichte Schlagzeilen und weiße Pillen-Knöpfe. Ruhig, souverän und bildstark, mit einem einzigen Minzgrün als Akzent.",
  "schlagworte": [
    "dunkel",
    "leichte Schrift",
    "Pillen-Knöpfe",
    "Verlaufsglühen",
    "große Headlines",
    "Plattform",
    "Minzakzent",
    "abgerundete Sektionen"
  ],
  "kategorien": [
    "Modern",
    "Dunkel",
    "Tech/SaaS"
  ],
  "gegenbeispiel": false
}
