{
  "name": "Werkbank dunkel",
  "slug": "werkbank-dunkel",
  "beschreibung": "Ein warmes, dunkles Werkzeug-Interface in schmaler Einspaltenbreite: Kästen mit eingekerbten Ecken, feine Linien und ein einziges Orange als Handlungsfarbe. Es wirkt wie ein kleines, spielerisches Labor für Bastler.",
  "schlagworte": [
    "dunkel",
    "warm",
    "werkzeug",
    "kompakt",
    "orange",
    "kerbecken",
    "schmal"
  ],
  "kategorien": [
    "Modern",
    "Minimal",
    "Dunkel",
    "Tech/SaaS",
    "Aktuell"
  ],
  "gegenbeispiel": false
}
