{
  "name": "Elfenbein ruhig",
  "slug": "elfenbein-ruhig",
  "beschreibung": "Warmes, papierhaftes Elfenbein mit fetter Grotesk als Schlagzeile und ruhiger Serife im Text. Große, weich gerundete Flächen und ein einziger Terrakotta-Akzent geben dem Ganzen eine nachdenkliche, menschliche Haltung.",
  "schlagworte": [
    "elfenbein",
    "serife",
    "grotesk",
    "warm",
    "ruhig",
    "terrakotta",
    "rund"
  ],
  "kategorien": [
    "Modern",
    "Minimal",
    "Editorial"
  ],
  "gegenbeispiel": false
}
