{
  "name": "Sportkatalog kantig",
  "slug": "sportkatalog-kantig",
  "beschreibung": "Ein bildstarker Online-Katalog mit tiefschwarzer Kopfleiste, weißem Grund und einem einzigen zarten Flieder-Band für Aktionen. Schmale, fette Versalien-Schrift und scharfkantige Knöpfe lassen die Produktfotos die Hauptrolle spielen.",
  "schlagworte": [
    "Katalog",
    "Versalien",
    "schwarz-weiß",
    "kantig",
    "bildstark",
    "Schmalschrift",
    "Aktionsband",
    "Kachelraster"
  ],
  "kategorien": [
    "Modern",
    "Minimal",
    "Dunkel"
  ],
  "gegenbeispiel": false
}
