{
  "name": "Marine weich",
  "slug": "marine-weich",
  "beschreibung": "Warmer Online-Shop-Stil auf cremigem Grund mit tiefem Marineblau, eleganter Serifen-Schlagzeile und runden Pillen-Knöpfen. Wirkt freundlich, hochwertig und alltagstauglich.",
  "schlagworte": [
    "Marine",
    "Creme",
    "Serife",
    "Pillenknöpfe",
    "Shop",
    "Warm",
    "Weich"
  ],
  "kategorien": [
    "Modern",
    "Minimal",
    "Editorial"
  ],
  "gegenbeispiel": false
}
