{
  "name": "Amtsblau schlicht",
  "slug": "amtsblau-schlicht",
  "beschreibung": "Sachlicher Behördenstil mit kräftigem Blau, tiefschwarzem Text und eckigen Flächen. Jede Seite ist auf Verständlichkeit, Tastaturbedienung und sofortiges Finden ausgelegt.",
  "schlagworte": [
    "Sachlich",
    "Klar",
    "Blau",
    "Eckig",
    "Barrierefrei",
    "Funktional"
  ],
  "kategorien": [
    "Business",
    "Minimal"
  ],
  "gegenbeispiel": false
}
