{
  "name": "Vitrine ruhig",
  "slug": "vitrine-ruhig",
  "beschreibung": "Produktbühne im Wechsel aus tiefem Schwarz und hellem Grau mit riesigen, eng gesetzten Überschriften und einem einzigen blauen Akzent. Alles tritt zurück, damit das Objekt wirkt.",
  "schlagworte": [
    "Vitrine",
    "Schwarz",
    "Hellgrau",
    "Pillen",
    "Produkt",
    "Zentriert",
    "Groteske"
  ],
  "kategorien": [
    "Modern",
    "Minimal",
    "Dunkel",
    "Luxus"
  ],
  "gegenbeispiel": false
}
