{
  "name": "Verlauf freundlich",
  "slug": "verlauf-freundlich",
  "beschreibung": "Leuchtender Violett-Türkis-Verlauf im Hero, weiße Flächen mit weichen Radien und eine große, freundliche Frage als Einstieg. Schwebende, leicht gekippte Sticker ersetzen klassische Produktbilder.",
  "schlagworte": [
    "Verlauf",
    "freundlich",
    "Sticker",
    "Pill-Knöpfe",
    "Violett",
    "Kreativ"
  ],
  "kategorien": [
    "Modern",
    "Verspielt",
    "Tech/SaaS"
  ],
  "gegenbeispiel": false
}
